ingredient_key,what_is_it,why_used,fun_fact,risk_label_human,health_impact_human,risk_label_dog,health_impact_dog,risk_label_cat,health_impact_cat,source
lecithins,"A group of ingredients that help oil and water stay mixed instead of separating.","They make food smoother, creamier, and more stable.","Lecithins are often used in chocolate, spreads, and creamy sauces.","caution","Usually fine in small amounts, but they still signal a more processed product.","safe","Usually okay for dogs in small amounts and commonly used to keep texture smooth.","safe","Usually okay for cats in small amounts and mainly used for texture, not nutrition.","HealthyWhooo profile v1"
oat_lecithin,"A plant-based emulsifier made from oats that helps different ingredients blend together.","It keeps products smooth and helps fat and water mix more evenly.","It is often seen as a plant-based alternative to soy lecithin.","caution","Generally low concern for people, but it is still part of processed food.","safe","Usually okay for dogs in small amounts and mostly used to improve texture.","safe","Usually okay for cats in small amounts and mainly helps keep food evenly mixed.","HealthyWhooo profile v1"
citric_acid,"A sour ingredient found naturally in citrus fruits and also made for food use.","It adds a tangy taste and helps keep food fresh for longer.","It is one of the most common additives in drinks, sweets, and sauces.","safe","Generally considered safe for most people and widely used in everyday foods.","safe","Usually safe for dogs in small food amounts, though very sour products may upset sensitive stomachs.","safe","Usually safe for cats in small food amounts, but it is not something they need in large amounts.","HealthyWhooo profile v1"
carrageenan,"A thickener from red seaweed that helps food stay smooth and creamy.","It improves texture and stops ingredients from separating.","Seaweed-based thickeners have been used in cooking for a very long time.","caution","Some people are okay with it, but others prefer to limit it because it is debated in digestion-related discussions.","caution","Often used in pet food and usually tolerated, but some dogs with sensitive stomachs may do better with less of it.","caution","Often used in pet food, but some cats with sensitive digestion may not tolerate it well.","HealthyWhooo profile v1"
guar_gum,"A thickener made from guar beans that helps food feel smooth and evenly mixed.","It improves texture and helps sauces, desserts, and spreads stay consistent.","Even a small amount can make a product feel much thicker.","caution","Usually tolerated well, but many people prefer fewer gums in highly processed foods.","safe","Usually okay for dogs in small amounts and commonly used to help texture.","safe","Usually okay for cats in small amounts, though too much may be harder on sensitive digestion.","HealthyWhooo profile v1"
chocolate,"A sweet ingredient made from cocoa beans, often mixed with sugar and milk.","It is used for its rich flavor, creamy texture, and comforting taste.","Chocolate was once so valuable that cocoa beans were used like money in ancient cultures.","caution","Usually fine for people in moderate amounts, especially darker chocolate, but too much can mean lots of sugar and calories.","avoid","Dangerous for dogs because it contains theobromine, which their bodies process very slowly.","avoid","Also unsafe for cats because compounds in chocolate can affect the nervous system and heart.","HealthyWhooo profile v1"
onion,"A sharp-tasting vegetable that adds depth and strong flavor to food.","It is used to make meals smell richer and taste more savory.","Cutting onions makes your eyes water because they release a gas that turns into a mild acid in your eyes.","safe","Fine for most people and even linked to helpful plant compounds when eaten in normal amounts.","avoid","Unsafe for dogs because it can damage red blood cells and cause serious illness.","avoid","Toxic for cats, and even small amounts can be harmful.","HealthyWhooo profile v1"
xylitol,"A sugar substitute that tastes sweet but has fewer calories than regular sugar.","It is used to sweeten products like chewing gum, candy, and some low-sugar foods.","Xylitol may sound like a lab chemical, but it can also be found naturally in tiny amounts in some fruits and vegetables.","safe","Generally safe for humans in normal food amounts, though too much may upset the stomach.","avoid","Very dangerous for dogs because it can cause a rapid insulin spike, low blood sugar, and even liver failure.","caution","Not known to be as dangerous for cats as for dogs, but it should still be avoided because it offers no benefit and may cause stomach upset.","HealthyWhooo profile v1"
carmine,"A red food coloring made from crushed cochineal insects.","It is used to give foods and drinks a bright pink or red color.","Yes, this color really can come from insects — which makes it one of the most surprising ingredients on many labels.","safe","Approved for human use, but some people avoid it for ethical, dietary, or allergy reasons.","safe","Usually not considered harmful to dogs in the small amounts used as coloring, but it adds color, not value.","safe","Usually not considered harmful to cats in very small food-coloring amounts, but it has no nutritional benefit.","HealthyWhooo profile v1"
lecithins,"A group of ingredients that help oil and water stay mixed instead of separating.","They are used to keep food smooth, creamy, and stable.","Lecithins are the quiet teamwork ingredient behind many chocolates, spreads, and creamy products.","caution","Usually fine in small amounts, but they still signal a more processed product.","safe","Usually okay for dogs in small food amounts and mainly used for texture.","safe","Usually okay for cats in small food amounts and mostly included to keep texture consistent.","HealthyWhooo profile v1"
palm_kernel_oil,"An oil extracted from the seeds of the oil palm fruit.","It is used to improve texture and make products creamy, stable, and longer-lasting.","Palm oil is one of the most widely used ingredients in the world — it’s in everything from cookies to cosmetics.","caution","Common in processed foods and safe in small amounts, but often linked to highly processed products and environmental concerns.","caution","Not toxic for dogs, but high fat content can be hard to digest and may contribute to weight gain.","caution","Not toxic for cats, but offers little nutritional value and is mainly used for texture.","HealthyWhooo profile v1"
milk_proteins,"Proteins naturally found in milk, such as casein and whey.","They are used to improve nutritional value and texture in dairy and processed foods.","Milk proteins are often added to boost protein content in snacks and drinks.","safe","Good source of protein for most people unless there is lactose intolerance or allergy.","safe","Generally safe for dogs in small amounts, especially in pet food formulas.","caution","Cats can digest some milk proteins, but many are lactose intolerant, so dairy-based ingredients may cause issues.","HealthyWhooo profile v1"
brilliant_blue_fcf,"A synthetic blue food coloring also known as E133.","It is used to give food and drinks a bright, eye-catching blue color.","Bright blue food doesn’t exist much in nature — that’s why this color is almost always artificial.","caution","Approved for use, but some people prefer to avoid artificial colorings in highly processed foods.","safe","Generally considered safe for dogs in small amounts, but has no nutritional value.","safe","Generally considered safe for cats in very small amounts, but used only for appearance.","HealthyWhooo profile v1"
flavourings,"A mix of natural or artificial substances that give food its smell and taste.","They are used to enhance or imitate flavors, making products more appealing.","“Natural flavor” doesn’t always mean simple — it can still be a complex mix of many compounds.","caution","Usually safe, but often unclear what exactly is included, which can reduce transparency.","caution","Generally safe for dogs in small amounts, but composition is often unspecified.","caution","Generally safe for cats in small amounts, but lacks transparency and nutritional value.","HealthyWhooo profile v1"
e472a,"An emulsifier made from fatty acids that helps ingredients mix together smoothly.","It is used to improve texture and keep food stable and evenly mixed.","Emulsifiers like this are the reason your food doesn’t separate into layers.","caution","Considered safe, but typically found in processed foods.","safe","Generally safe for dogs in small amounts and mainly used for texture.","safe","Generally safe for cats in small amounts and has no direct health effect.","HealthyWhooo profile v1"
sugar,"A simple carbohydrate used to sweeten food and drinks.","It is added to improve taste and increase product appeal.","Sugar can appear under many different names, making it harder to recognize on labels.","caution","Fine in small amounts, but high intake is linked to many health issues.","caution","Not toxic for dogs, but unnecessary and can contribute to obesity and dental problems.","caution","Not needed in a cat’s diet and offers no nutritional benefit.","HealthyWhooo profile v1"
whey_powder,"A dairy by-product obtained during cheese production.","It is used to add flavor, protein, and improve texture in foods.","Whey was once considered waste — now it’s widely used in food and supplements.","safe","Provides protein, but may cause issues for people with lactose intolerance.","safe","Generally safe for dogs in small amounts and often used in pet food.","caution","Cats may have trouble digesting dairy components, so tolerance can vary.","HealthyWhooo profile v1"
modified_starch,"A starch that has been physically or chemically altered to change its behavior.","It is used to thicken, stabilize, and improve the texture of food.","Despite the name, modified starch is not necessarily harmful — it just behaves differently than regular starch.","caution","Generally safe, but indicates a more processed product.","safe","Safe for dogs in small amounts and commonly used in pet food.","safe","Safe for cats in small amounts and mainly affects texture.","HealthyWhooo profile v1"
skimmed_milk_powder,"Milk that has had most of its fat removed and then dried into powder form.","It is used to add milk flavor and nutrients without extra fat.","Powdered milk lasts much longer than fresh milk, which makes it useful in many products.","safe","Good source of protein and nutrients, but may cause issues for lactose-intolerant individuals.","safe","Generally safe for dogs in small amounts.","caution","Many cats are lactose intolerant, so this ingredient may cause digestive discomfort.","HealthyWhooo profile v1"
turmeric,"A yellow spice made from the root of the turmeric plant.","It is used for color, flavor, and sometimes for its perceived health properties.","Turmeric has been used for centuries in cooking and traditional medicine.","safe","Generally safe and often associated with anti-inflammatory properties.","safe","Safe for dogs in small amounts and sometimes used in pet diets.","safe","Safe for cats in small amounts, but not essential.","HealthyWhooo profile v1"
guar_gum,"A thickening agent made from guar beans.","It is used to improve texture and keep ingredients evenly mixed.","Guar gum can absorb many times its weight in water, which helps create creamy textures.","caution","Usually tolerated well, but some people prefer to limit gums in processed foods.","caution","Generally safe for dogs, but large amounts may affect digestion.","caution","Generally safe for cats in small amounts, but excessive intake may cause digestive issues.","HealthyWhooo profile v1"
xanthan_gum,"A thickener created through natural fermentation using bacteria.","It helps food become thicker and keeps ingredients evenly mixed.","Xanthan gum is widely used in gluten-free products because it helps replace the texture of gluten.","caution","Generally considered safe, but often found in processed foods and sometimes avoided by people sensitive to gums.","caution","Usually safe for dogs in small amounts, but large amounts may cause digestive discomfort.","caution","Usually safe for cats in small amounts, but too much may be harder to digest.","HealthyWhooo profile v1"
pectins,"A natural thickener found in fruits like apples and citrus peels.","It helps jams, desserts, and fillings set and keep their shape.","Pectin is what makes jam thick without needing artificial chemicals.","safe","Naturally occurring and generally safe, often seen as a more “natural” thickening option.","safe","Safe for dogs and sometimes even used to support digestion in small amounts.","safe","Safe for cats in small amounts and generally easy to tolerate.","HealthyWhooo profile v1"
mono_diglycerides,"Processed fats that help water and oil stay mixed in food.","They improve texture and keep products soft, smooth, and stable.","These ingredients are often made from vegetable oils but go through multiple processing steps.","caution","Generally safe, but highly processed and commonly found in industrial food products.","safe","Usually safe for dogs in small amounts and mainly used to improve texture.","safe","Usually safe for cats in small amounts and has no direct nutritional benefit.","HealthyWhooo profile v1"
citric_esters_mono_diglycerides,"An emulsifier made from fats combined with citric acid.","It helps keep food smooth and prevents ingredients from separating.","Despite the complex name, its job is simple: keeping food from falling apart.","caution","Considered safe, but typically found in processed foods and not needed in simple diets.","safe","Usually safe for dogs in small amounts and mainly affects texture.","safe","Usually safe for cats in small amounts and used only for stability.","HealthyWhooo profile v1"
pgpr,"A highly processed emulsifier used mainly in chocolate.","It makes chocolate smoother, thinner, and easier to work with during production.","Without ingredients like PGPR, your chocolate bar might feel thicker and less smooth — it’s part of what gives chocolate that melt-in-your-mouth texture.","caution","Generally considered safe in small amounts, but it is a highly processed additive.","safe","Usually safe for dogs in very small amounts, but mainly adds texture, not nutrition.","safe","Usually safe for cats in small amounts and has no nutritional value.","HealthyWhooo profile v1"
sodium_carbonates,"A group of mineral salts commonly used in baking, including baking soda.","They help dough rise and create light, fluffy textures in baked goods.","These ingredients are behind the bubbles that make cakes soft and airy.","safe","Generally safe and widely used in everyday cooking and baking.","safe","Safe for dogs in small food amounts.","safe","Safe for cats in small food amounts and not harmful in typical use.","HealthyWhooo profile v1"
monosodium_glutamate,"A flavour enhancer that boosts savory taste, also known as MSG.","It makes food taste richer, deeper, and more “umami”.","MSG has been controversial for years, but most scientific reviews consider it safe in normal amounts.","caution","Generally safe, but some people report sensitivity or prefer to avoid it.","safe","Usually safe for dogs in small amounts, but adds flavor rather than nutrition.","safe","Usually safe for cats in small amounts and mainly enhances taste.","HealthyWhooo profile v1"
acesulfame_k,"A very strong artificial sweetener that adds sweetness without sugar.","It is used in diet drinks and low-sugar foods to replace sugar.","Acesulfame K is much sweeter than sugar, so only tiny amounts are needed.","caution","Approved for use, but often avoided by people who prefer fewer artificial sweeteners.","caution","Not toxic for dogs, but offers no benefit and is not recommended in regular diets.","caution","Not useful for cats and adds no nutritional value.","HealthyWhooo profile v1"
aspartame,"A low-calorie artificial sweetener used in many diet products.","It replaces sugar to reduce calories while keeping sweetness.","Aspartame is one of the most debated food ingredients, even though it is approved by regulators.","caution","Considered safe in regulated amounts, but still widely debated.","caution","Not beneficial for dogs and should not be a regular part of their diet.","caution","Not useful for cats and adds no nutritional value.","HealthyWhooo profile v1"
cyclamates,"A group of artificial sweeteners used to add sweetness without calories.","They are often used in tabletop sweeteners and diet products.","Cyclamates were once banned in some countries, which still makes them a topic of debate today.","caution","Approved in many regions, but often avoided by people who prefer more natural options.","caution","Not toxic for dogs in small amounts, but unnecessary and not recommended.","caution","Not useful for cats and offers no nutritional value.","HealthyWhooo profile v1"
isomalt,"A sugar alcohol used as a low-calorie sweetener.","It provides sweetness with fewer calories than regular sugar.","Isomalt is often used in sugar-free candies and can create that slightly “cooling” taste.","caution","Generally safe, but large amounts can cause digestive discomfort.","caution","Not toxic for dogs, but can cause stomach upset if eaten in larger amounts.","caution","Not needed for cats and may affect digestion if consumed in larger amounts.","HealthyWhooo profile v1"
saccharin,"A very strong artificial sweetener used to replace sugar.","It adds sweetness without adding calories.","Saccharin is one of the oldest artificial sweeteners still in use today.","caution","Approved for use, but often avoided by people who prefer fewer artificial ingredients.","caution","Not toxic for dogs, but provides no benefit and is best limited.","caution","Not useful for cats and has no nutritional role.","HealthyWhooo profile v1"
sucralose,"A high-intensity sweetener made from sugar through chemical processing.","It keeps food sweet without adding much energy.","Sucralose stays sweet even when heated, which makes it useful in baking.","caution","Considered safe, but often avoided by people reducing artificial sweeteners.","caution","Not toxic for dogs in small amounts, but unnecessary and not recommended.","caution","Not useful for cats and offers no nutritional benefit.","HealthyWhooo profile v1"
steviol_glycosides,"A sweetener extracted from the stevia plant.","It provides sweetness without regular sugar.","Stevia-based sweeteners can be many times sweeter than sugar, even in tiny amounts.","caution","Often seen as a more natural option, but taste and tolerance vary.","safe","Generally safe for dogs in small amounts.","safe","Generally safe for cats in small amounts, though not nutritionally needed.","HealthyWhooo profile v1"
maltitols,"A group of sugar alcohol sweeteners used to replace regular sugar.","They add sweetness with fewer calories and are often used in sugar-free products.","Maltitols are common in “sugar-free” chocolate — but eating too much can still have noticeable effects.","caution","Generally safe, but large amounts can cause bloating or digestive discomfort.","caution","Not toxic for dogs, but may cause stomach upset and offers no real benefit.","caution","Not needed in a cat’s diet and may affect digestion if consumed in larger amounts.","HealthyWhooo profile v1"
erythritol,"A low-calorie sugar alcohol used as a sweetener.","It provides sweetness without regular sugar and is popular in low-carb products.","Erythritol is often better tolerated than other sugar alcohols, but too much can still upset digestion.","caution","Generally safe, but large amounts may cause digestive discomfort.","caution","Not toxic for dogs in small amounts, but unnecessary and may upset digestion.","caution","Not useful for cats and offers no nutritional benefit.","HealthyWhooo profile v1"
ascorbic_acid,"A form of vitamin C used in food.","It helps keep products fresh and can support stability in food processing.","Despite its technical name, this is simply vitamin C — something your body actually needs.","safe","Generally safe and even beneficial as a vitamin in normal amounts.","safe","Safe for dogs and sometimes included in pet food for stability.","safe","Safe for cats in small amounts and not harmful in typical use.","HealthyWhooo profile v1"
sodium_ascorbate,"A sodium-based form of vitamin C.","It helps keep food fresh and stable, especially in processed products.","It’s basically vitamin C with a slight chemical twist to make it easier to use in food.","safe","Generally safe and functions similarly to vitamin C.","safe","Safe for dogs in small amounts and commonly used in food processing.","safe","Safe for cats in small amounts and not harmful.","HealthyWhooo profile v1"
tocopherol_extract,"A natural antioxidant related to vitamin E.","It protects fats and oils from going bad.","Tocopherols are often used as a more “natural” alternative to synthetic preservatives.","safe","Generally safe and often seen as a positive additive compared to synthetic options.","safe","Safe for dogs and sometimes used to preserve pet food naturally.","safe","Safe for cats and commonly used to protect fats in food.","HealthyWhooo profile v1"
bha,"A synthetic antioxidant used to keep fats from spoiling.","It helps extend shelf life in processed foods.","BHA has been debated for years, which is why many people prefer to limit it.","caution","Approved for use, but often limited by people trying to avoid synthetic additives.","caution","Allowed in pet food, but many prefer to limit synthetic preservatives.","caution","Used in some pet foods, but often avoided in more premium diets.","HealthyWhooo profile v1"
bht,"A synthetic antioxidant similar to BHA.","It prevents fats from going rancid and extends shelf life.","BHT is often mentioned together with BHA in discussions about food additives.","caution","Approved, but often limited by people avoiding synthetic preservatives.","caution","Used in pet food, but many owners prefer more natural alternatives.","caution","Common in some pet foods, but often avoided in higher-quality diets.","HealthyWhooo profile v1"
sorbic_acid,"A preservative that stops mold and yeast from growing.","It helps food stay safe and last longer.","Without preservatives like this, many foods would spoil much faster.","caution","Generally safe, but some people prefer fewer preservatives in their diet.","safe","Safe for dogs in small amounts and commonly used in food preservation.","safe","Safe for cats in small amounts and helps prevent spoilage.","HealthyWhooo profile v1"
potassium_sorbate,"A widely used preservative that prevents mold and yeast.","It extends the shelf life of many packaged foods.","It is one of the most common preservatives you’ll find on food labels.","caution","Approved for use, but often limited by people seeking less processed food.","safe","Safe for dogs in small amounts and commonly used in food products.","safe","Safe for cats in small amounts and helps keep food fresh.","HealthyWhooo profile v1"
benzoic_acid,"A preservative used to slow down the growth of bacteria, yeast, and mold.","It helps food and drinks stay fresh for longer.","It works best in acidic foods like soft drinks and fruit products.","caution","Generally safe, but many people prefer fewer preservatives in everyday food.","safe","Safe for dogs in small amounts and mainly used to prevent spoilage.","safe","Safe for cats in small amounts and helps keep food stable.","HealthyWhooo profile v1"
sodium_benzoate,"A preservative made from benzoic acid, commonly used in drinks.","It helps prevent spoilage and keeps products safe to consume longer.","It is especially common in soft drinks, sauces, and packaged foods.","caution","Approved for use, but often limited by people trying to reduce processed additives.","safe","Safe for dogs in small amounts and used to preserve food.","safe","Safe for cats in small amounts and helps prevent spoilage.","HealthyWhooo profile v1"
sulphur_dioxide,"A preservative gas used to protect food from spoilage and discoloration.","It helps keep foods like dried fruit and wine looking fresh and stable.","Some people are sensitive to sulphites, which is why this ingredient is often highlighted on labels.","caution","Generally safe, but can cause reactions in sensitive individuals.","caution","Usually safe for dogs in small amounts, but not needed in fresh diets.","caution","Usually safe for cats in small amounts, though unnecessary in most diets.","HealthyWhooo profile v1"
sodium_nitrite,"A curing agent used in processed meats.","It preserves meat and keeps its pink color.","Without it, many processed meats would look grey instead of pink.","caution","Often recommended to limit because it is linked to processed meat consumption.","caution","Used in some pet foods, but generally better limited in frequent diets.","caution","Not ideal for regular consumption in cats and often limited in higher-quality diets.","HealthyWhooo profile v1"
sodium_nitrate,"A preservative used in curing and preserving meats.","It helps extend shelf life and supports the curing process.","It can convert into other compounds during processing or digestion.","caution","Often limited due to its link with processed meat products.","caution","Not toxic for dogs in small amounts, but not ideal for regular consumption.","caution","Not recommended in frequent cat diets and mainly used in processed foods.","HealthyWhooo profile v1"
