ingredient_key,what_is_it,why_used,fun_fact,risk_label_human,health_impact_human,risk_label_dog,health_impact_dog,risk_label_cat,health_impact_cat,source
"corn_starch","A fine powder made from corn.","Used to thicken sauces, soups, and desserts.","A classic kitchen ingredient for smooth sauces.","safe","Generally safe and naturally gluten-free.","safe","Safe for dogs in small amounts.","safe","Safe for cats in small amounts.","EU food labels"
"maize_starch","Another name for corn starch.","Used in cooking to thicken and improve texture.","Common in both home cooking and processed foods.","safe","Generally safe and naturally gluten-free.","safe","Safe for dogs in small amounts.","safe","Safe for cats in small amounts.","EU food labels"
"potato_starch","A starch extracted from potatoes.","Used to thicken soups, sauces, and baked goods.","Popular in many European recipes.","safe","Generally safe and naturally gluten-free.","safe","Safe for dogs in small amounts.","safe","Safe for cats in small amounts.","EU food labels"
"rice_starch","A starch made from rice grains.","Used in gluten-free foods and delicate recipes.","Often used in baby foods for its mild nature.","safe","Generally safe and naturally gluten-free.","safe","Safe for dogs in small amounts.","safe","Safe for cats in small amounts.","EU food labels"
"tapioca_starch","A starch extracted from cassava root.","Used to thicken desserts and give a chewy texture.","It’s what makes bubble tea pearls soft and chewy.","safe","Generally safe and naturally gluten-free.","safe","Safe for dogs in small amounts.","safe","Safe for cats in small amounts.","EU food labels"
"modified_starch","A starch that has been processed to work better in food.","Used to stabilize texture and extend shelf life.","Often found in processed foods for consistency.","caution","Generally safe, but more processed and sometimes questioned by consumers.","safe","Safe for dogs in small amounts.","safe","Safe for cats in small amounts.","EU food labels"
"modified_maize_starch","A processed version of corn starch designed to work better in food.","Used to keep sauces smooth and products stable.","Helps foods keep their texture even after heating or freezing.","caution","Generally safe, but more processed and sometimes questioned by consumers.","safe","Safe for dogs in small amounts.","safe","Safe for cats in small amounts.","EU food labels"
"modified_potato_starch","A modified starch made from potatoes.","Used to improve texture and prevent sauces from separating.","Common in ready meals and processed foods.","caution","Generally safe, but indicates a higher level of processing.","safe","Safe for dogs in small amounts.","safe","Safe for cats in small amounts.","EU food labels"
"modified_tapioca_starch","A processed starch from cassava root.","Used to stabilize texture in desserts and sauces.","Often used to create smooth and consistent textures.","caution","Generally safe, but more processed than natural starch.","safe","Safe for dogs in small amounts.","safe","Safe for cats in small amounts.","EU food labels"
"sunflower_oil","An oil extracted from sunflower seeds.","Used for frying, cooking, and in many packaged foods.","Sunflowers naturally turn to follow the sun during the day.","safe","Generally safe when used in moderation.","safe","Safe for dogs in small amounts.","safe","Safe for cats in small amounts.","EU food labels"
"high_oleic_sunflower_oil","A type of sunflower oil with more stable fats.","Used for frying and in snacks due to better heat resistance.","Often chosen by food brands for longer shelf life.","safe","Generally safe and more stable at high temperatures.","safe","Safe for dogs in small amounts.","safe","Safe for cats in small amounts.","EU food labels"
"rapeseed_oil","A widely used plant oil made from rapeseed.","Used in cooking and many processed foods.","One of the most common cooking oils in Europe.","safe","Generally safe and considered a balanced cooking oil.","safe","Safe for dogs in small amounts.","safe","Safe for cats in small amounts.","EU food labels"
"canola_oil","A refined oil made from a special type of rapeseed.","Used in cooking and packaged foods.","The name comes from 'Canadian oil'.","safe","Generally safe and widely used in everyday cooking.","safe","Safe for dogs in small amounts.","safe","Safe for cats in small amounts.","EU food labels"
"olive_oil","Oil pressed from olives.","Used in cooking, salads, and sauces.","A key part of the Mediterranean diet.","safe","Generally safe and often seen as a healthy fat when used in moderation.","safe","Safe for dogs in small amounts.","safe","Safe for cats in small amounts.","EU food labels"
"extra_virgin_olive_oil","A high-quality olive oil made without heat or heavy processing.","Used in salads, dips, and light cooking.","Known for its rich taste and premium quality.","safe","Generally safe and valued for its natural antioxidants.","safe","Safe for dogs in small amounts.","safe","Safe for cats in small amounts.","EU food labels"
"pomace_olive_oil","Oil extracted from leftover olive pulp after pressing.","Used in frying and processed foods.","More processed than extra virgin olive oil.","caution","Generally safe, but more refined and lower in nutrients than higher-quality olive oils.","safe","Safe for dogs in small amounts.","safe","Safe for cats in small amounts.","EU food labels"
"coconut_oil","An oil made from the flesh of coconuts.","Used in cooking, baking, and some processed foods.","Very popular in tropical cuisines and health trends.","caution","High in saturated fat, so best used in moderation.","safe","Safe for dogs in small amounts.","safe","Safe for cats in small amounts."
"palm_oil","An oil extracted from the fruit of oil palm trees.","Used widely in processed foods for texture and shelf life.","Often debated due to environmental and sustainability concerns.","limit","Safe to eat, but best to limit due to high saturated fat and controversies.","safe","Safe for dogs in small amounts.","safe","Safe for cats in small amounts."
"palm_fat","A solid fat made from palm oil.","Used in baked goods like biscuits and pastries.","Very common in processed snacks.","limit","Safe to eat, but best to limit due to high saturated fat and sustainability concerns.","safe","Safe for dogs in small amounts.","safe","Safe for cats in small amounts."
"shea_butter","A fat extracted from nuts of the shea tree.","Used occasionally in chocolate and confectionery.","Better known as a popular skincare ingredient.","safe","Generally safe in food when used in small amounts.","safe","Safe for dogs in small amounts.","safe","Safe for cats in small amounts."
"cocoa_butter","A natural fat found in cocoa beans.","Used to give chocolate its smooth texture and melt.","Real chocolate must contain cocoa butter.","safe","Generally safe and part of chocolate, but high in fat.","caution","Safe in very small amounts, but chocolate products can be harmful to dogs.","caution","Safe in very small amounts, but chocolate products are toxic to cats."
"butter","A dairy fat made by churning cream.","Used in cooking, baking, and spreads.","Butter has been enjoyed for thousands of years.","safe","Generally safe, but high in saturated fat so best in moderation.","safe","Safe for dogs in small amounts.","caution","Safe in very small amounts, but many cats are lactose sensitive."
"clarified_butter","Butter with water and milk solids removed.","Used for frying because it handles high heat well.","Also known as a cleaner, more stable form of butter.","safe","Generally safe and easier to digest than regular butter.","safe","Safe for dogs in small amounts.","safe","Safe for cats in small amounts."
"ghee","A traditional clarified butter commonly used in Indian cuisine.","Used for cooking and rich flavor.","Can be stored longer than regular butter without refrigeration.","safe","Generally safe, but high in fat so use in moderation.","safe","Safe for dogs in small amounts.","safe","Safe for cats in small amounts."
"milk_fat","The natural fat found in milk and dairy products.","Used to add richness and creamy texture.","Responsible for the taste of full-fat dairy products.","safe","Generally safe, but high intake may not suit everyone.","safe","Safe for dogs in small amounts.","caution","Safe in small amounts, but some cats may be sensitive."
"vegetable_oil","A general term for oils made from plants.","Used widely in cooking and processed foods.","The exact type of oil is often not specified on labels.","caution","Generally safe, but quality varies and highly processed types are often debated.","safe","Safe for dogs in small amounts.","safe","Safe for cats in small amounts.","EU food labels"
"vegetable_fat","A general term for fats made from plants.","Used in baked goods, spreads, and processed foods.","Often highly processed and the exact source may not be clear.","caution","Generally safe, but quality and source can vary.","safe","Safe for dogs in small amounts.","safe","Safe for cats in small amounts.","EU food labels"
"soybean_oil","An oil made from soybeans.","Used in cooking and many processed foods.","One of the most widely produced oils in the world.","safe","Generally safe when consumed in moderation.","safe","Safe for dogs in small amounts.","safe","Safe for cats in small amounts.","EU food labels"
"corn_oil","An oil extracted from corn.","Used for frying and in processed foods.","Common in large-scale food production.","safe","Generally safe when used in moderation.","safe","Safe for dogs in small amounts.","safe","Safe for cats in small amounts.","EU food labels"
"groundnut_oil","An oil made from peanuts.","Used for frying and cooking, especially in Asian cuisine.","Has a high smoke point, making it great for deep frying.","caution","Safe for most people, but may trigger peanut allergies.","safe","Safe for dogs in small amounts unless allergic.","safe","Safe for cats in small amounts unless allergic.","EU food labels"
"peanut_oil","Another name for oil made from peanuts.","Used widely in cooking and frying.","Popular for its neutral taste and high heat tolerance.","caution","Safe for most people, but may trigger peanut allergies.","safe","Safe for dogs in small amounts unless allergic.","safe","Safe for cats in small amounts unless allergic.","EU food labels"
"sesame_oil","An oil made from sesame seeds.","Used to add flavor in many Asian dishes.","Known for its strong, nutty aroma.","caution","Generally safe, but may trigger sesame allergies in sensitive individuals.","safe","Safe for dogs in small amounts.","safe","Safe for cats in small amounts.","EU food labels"
"linseed_oil","An oil made from flax seeds.","Used in cold dishes and as a supplement.","Rich in omega-3 fatty acids.","safe","Generally safe and valued for its healthy fats.","safe","Safe for dogs in small amounts.","safe","Safe for cats in small amounts.","EU food labels"
"flaxseed_oil","Another name for linseed oil from flax seeds.","Used in salads and nutritional supplements.","Should not be heated, as it can lose its benefits.","safe","Generally safe and a good source of healthy fats.","safe","Safe for dogs in small amounts.","safe","Safe for cats in small amounts.","EU food labels"
"walnut_oil","An oil pressed from walnuts.","Used in gourmet dishes and salads.","Has a rich, nutty flavor.","caution","Generally safe, but may trigger nut allergies.","safe","Safe for dogs in small amounts.","safe","Safe for cats in small amounts.","EU food labels"
"hazelnut_oil","An oil extracted from hazelnuts.","Used in desserts and flavoring.","Often found in premium or gourmet foods.","caution","Generally safe, but may trigger nut allergies.","safe","Safe for dogs in small amounts.","safe","Safe for cats in small amounts.","EU food labels"
"rice_bran_oil","An oil made from the outer layer of rice grains.","Used for frying and cooking thanks to its high heat stability.","Popular in Asian kitchens for its mild taste.","safe","Generally safe and stable for cooking, may help support healthy cholesterol levels when used instead of saturated fats.","safe","Safe for dogs in small amounts, but too much fat may lead to weight gain or digestive upset.","safe","Safe for cats in small amounts, but excess fat can be hard to digest.","EU food labels"
"grapeseed_oil","An oil extracted from grape seeds, often a byproduct of winemaking.","Used in cooking, frying, and salad dressings.","Light taste makes it popular in gourmet cooking.","safe","Generally safe, but highly processed versions may be debated; high in omega-6 which should be balanced in the diet.","safe","Safe for dogs in small amounts, but too much may cause stomach upset.","safe","Safe for cats in small amounts, though not nutritionally necessary.","EU food labels"
"milk","A natural liquid produced by mammals, commonly from cows.","Used as a base for many dairy products and drinks.","Consumed by humans for thousands of years.","safe","Nutritious source of protein and calcium, but may cause bloating or discomfort in people with lactose intolerance.","safe","Safe for dogs in small amounts, but too much can cause diarrhea due to lactose.","caution","Many cats are lactose intolerant, which can lead to digestive upset."
,"EU food labels"
"whole_milk","Milk that keeps its natural fat content.","Used for drinking, cooking, and dairy products.","Closest to milk in its natural form.","safe","Rich in nutrients but also higher in saturated fat, so best consumed in moderation.","safe","Safe for dogs in small amounts, but can cause digestive upset if overfed.","caution","Cats often have trouble digesting lactose, which may lead to stomach issues.","EU food labels"
"semi_skimmed_milk","Milk with part of the fat removed.","Used as a lighter option for drinks and cooking.","A popular everyday choice in many countries.","safe","Balanced option with less fat, but still contains lactose which may cause discomfort for some people.","safe","Safe for dogs in small amounts, but lactose may cause mild digestive issues.","caution","May cause digestive upset in cats due to lactose content.","EU food labels"
"skimmed_milk","Milk with most of the fat removed.","Used in low-calorie and low-fat diets.","Still contains protein and important minerals.","safe","Lower in fat but still contains lactose, which may cause bloating or discomfort in sensitive individuals.","safe","Safe for dogs in small amounts, but lactose can still cause diarrhea.","caution","Not ideal for cats, as lactose may cause digestive problems.","EU food labels"
"fresh_milk","Milk that has undergone minimal processing.","Used for drinking and cooking.","Spoils faster than more processed milk.","safe","Nutritious but more perishable; lactose may still be an issue for sensitive people.","safe","Safe for dogs in small amounts, but should not be given regularly.","caution","Cats may experience digestive upset due to lactose.","EU food labels"
"cream","The rich, fatty part separated from milk.","Used in sauces, desserts, and coffee.","Gives dishes a smooth and creamy texture.","safe","High in fat and calories, so best enjoyed in moderation; excessive intake may impact heart health.","safe","Safe for dogs in small amounts, but too much fat can cause pancreatitis or stomach upset.","caution","Cats may tolerate small amounts, but high fat and lactose can cause issues.","EU food labels"
"double_cream","A very thick cream with a high fat content.","Used in desserts and rich dishes.","Known for its indulgent taste and texture.","safe","Very high in saturated fat, so best limited; overconsumption may impact cholesterol levels.","safe","Safe for dogs in very small amounts, but high fat can trigger digestive issues or pancreatitis.","caution","Too rich for most cats, may cause digestive upset.","EU food labels"
"whipping_cream","A cream that can be whipped into a light foam.","Used in desserts and cakes.","Expands when whipped by trapping air.","safe","High in fat and calories; fine occasionally but not ideal for daily consumption.","safe","Safe for dogs in small amounts, but excess fat may lead to stomach upset.","caution","Cats may have trouble digesting it due to lactose and fat content.","EU food labels"
"sour_cream","A fermented cream with a slightly tangy taste.","Used in sauces, dips, and toppings.","Popular in many Eastern European dishes.","safe","Contains beneficial bacteria, but still high in fat; may cause issues for people sensitive to lactose.","safe","Safe for dogs in small amounts, but too much can cause stomach upset due to fat.","caution","Cats may have trouble digesting it due to lactose and fat content.","EU food labels"
"creme_fraiche","A thick, cultured cream with a mild tangy flavor.","Used in sauces, soups, and desserts.","A staple in French cuisine for its smooth texture.","safe","Generally safe, but high in fat and calories; easier to digest than some dairy due to fermentation.","safe","Safe for dogs in small amounts, but rich fat content may upset digestion.","caution","Cats may tolerate small amounts, but lactose and fat can cause issues.","EU food labels"
"yogurt","A fermented milk product made with live cultures.","Used in breakfast foods, desserts, and sauces.","Known for its natural probiotics.","safe","Good source of probiotics that support gut health, but may still cause issues for lactose-intolerant individuals.","safe","Often safe for dogs and can support digestion in small amounts.","caution","Some cats tolerate small amounts, but lactose may still cause digestive upset.","EU food labels"
"greek_yogurt","A thick, strained yogurt with high protein content.","Used in both sweet and savory dishes.","Popular in Mediterranean diets.","safe","High in protein and probiotics; often easier to digest due to lower lactose, but still not suitable for everyone.","safe","Safe for dogs in small amounts and often used as a treat.","safe","May be better tolerated than regular milk, but still should be given in small amounts.","EU food labels"
"kefir","A fermented milk drink rich in probiotics.","Used as a drink or in smoothies.","Contains a wide variety of beneficial microbes.","safe","Supports gut health thanks to probiotics, but may cause mild bloating in sensitive individuals.","safe","Safe for dogs in small amounts and may support digestion.","caution","Cats may tolerate small amounts, but some may still experience digestive upset.","EU food labels"
"buttermilk","A fermented dairy drink with a slightly sour taste.","Used in baking and traditional recipes.","Gives pancakes and baked goods a soft texture.","safe","Generally safe and easier to digest than regular milk, but still contains lactose.","safe","Safe for dogs in small amounts.","caution","Cats may experience digestive issues due to lactose.","EU food labels"
"whey","The liquid left after milk is turned into cheese.","Used in protein products and food processing.","A key ingredient in many sports nutrition products.","safe","Rich in protein and nutrients, but may cause digestive discomfort in lactose-sensitive individuals.","safe","Safe for dogs in small amounts.","caution","Cats may have difficulty digesting lactose in whey.","EU food labels"
"whey_powder","Dried form of whey used in food products.","Used in snacks, baked goods, and protein products.","Common in protein bars and processed foods.","safe","High in protein but processed; may cause bloating or discomfort in some people.","safe","Safe for dogs in small amounts.","caution","Cats may not digest it well due to lactose content.","EU food labels"
"whey_protein","Protein extracted from whey.","Used in supplements and high-protein foods.","Very popular among athletes and fitness enthusiasts.","safe","Supports muscle growth and recovery, but may cause digestive issues for those sensitive to dairy.","safe","Safe for dogs in small amounts.","caution","Not ideal for cats; may be hard to digest in larger amounts.","EU food labels"
"whey_protein_concentrate","A concentrated form of whey protein.","Used in protein shakes and sports nutrition.","Contains slightly more lactose than isolates.","safe","High in protein but may cause bloating or discomfort in lactose-sensitive individuals.","safe","Safe for dogs in small amounts.","caution","May be harder for cats to digest due to lactose content.","EU food labels"
"milk_powder","Milk that has been dried into a powder.","Used in chocolate, baking, and many processed foods.","Lasts much longer than fresh milk.","safe","Provides protein and minerals, but still contains lactose which may cause bloating or discomfort in sensitive individuals.","safe","Safe for dogs in small amounts, but too much may upset digestion.","caution","Cats may have trouble digesting lactose, leading to stomach upset.","EU food labels"
"skimmed_milk_powder","Powdered milk with most of the fat removed.","Used in baking and processed foods.","A lower-fat dairy option in powdered form.","safe","Lower in fat but still contains lactose, which may cause digestive issues for some people.","safe","Safe for dogs in small amounts.","caution","May cause digestive upset in cats due to lactose.","EU food labels"
"whole_milk_powder","Powdered milk that retains its natural fat.","Used in desserts, chocolate, and drinks.","Adds a rich and creamy flavor to foods.","safe","More calorie-dense due to fat; may cause issues for lactose-intolerant individuals.","safe","Safe for dogs in small amounts, but high fat may upset digestion.","caution","Cats may struggle to digest lactose and fat.","EU food labels"
"condensed_milk","Milk that has been concentrated and sweetened.","Used in desserts and sweet recipes.","Very thick and sugary.","limit","High in sugar and calories, so best consumed occasionally; may contribute to weight gain or blood sugar spikes.","safe","Safe for dogs only in very small amounts due to high sugar.","caution","Too much sugar and lactose can cause digestive upset in cats.","EU food labels"
"evaporated_milk","Milk concentrated by removing part of its water, without added sugar.","Used in cooking and creamy dishes.","Shelf-stable alternative to fresh milk.","safe","Still contains lactose; can be easier to digest for some, but may cause discomfort in sensitive individuals.","safe","Safe for dogs in small amounts.","caution","Cats may experience digestive issues due to lactose.","EU food labels"
"cheese","A food made by curdling milk into solid pieces.","Used in countless dishes around the world.","There are thousands of different cheese varieties.","safe","Rich in protein and calcium, but also high in salt and fat; some people may be sensitive to lactose.","safe","Safe for dogs in small amounts, but too much fat or salt is not recommended.","caution","Many cats are lactose intolerant, though some tolerate small amounts.","EU food labels"
"cheddar_cheese","A firm cheese with a rich, sharp flavor.","Used in sandwiches, snacks, and cooking.","One of the most popular cheeses worldwide.","safe","High in protein but also in saturated fat and salt; best eaten in moderation.","safe","Safe for dogs in small amounts, but avoid large portions due to fat and salt.","caution","Cats may tolerate small amounts, but too much can cause digestive upset.","EU food labels"
"mozzarella","A soft cheese with a mild taste.","Used mainly on pizza and in salads.","Traditionally made from buffalo milk.","safe","Lower in salt than many cheeses, but still contains fat and lactose.","safe","Safe for dogs in small amounts.","safe","Often better tolerated by cats than other cheeses, but still should be limited.","EU food labels"
"gouda","A semi-hard cheese with a mild, creamy flavor.","Used in sandwiches and cooking.","Named after a city in the Netherlands.","safe","Contains protein and calcium, but also fat and salt; moderation is key.","safe","Safe for dogs in small amounts.","caution","Cats may tolerate small amounts, but lactose and fat can cause issues.","EU food labels"
"parmesan","A hard, aged cheese with a strong flavor.","Used grated over pasta and dishes.","Aged for many months to develop its taste.","safe","Very low in lactose but high in salt; usually well tolerated in small amounts.","safe","Safe for dogs in small amounts, but watch salt intake.","safe","Often tolerated better by cats due to low lactose, but still should be limited.","EU food labels"
"soft_cheese","A group of cheeses with a soft, creamy texture.","Used in spreads, cooking, and light dishes.","Includes popular cheeses like brie or camembert.","safe","Generally safe, but can be higher in fat and sometimes salt; some soft cheeses may not be suitable during pregnancy if unpasteurized.","safe","Safe for dogs in small amounts, but rich fat can cause stomach upset.","caution","Cats may tolerate small amounts, but lactose and fat can lead to digestive issues.","EU food labels"
"hard_cheese","Cheese that has been aged until firm and dense.","Used sliced, grated, or melted in dishes.","Aging gives it a stronger flavor and longer shelf life.","safe","Often lower in lactose but higher in salt and fat; overconsumption may impact heart health.","safe","Safe for dogs in small amounts, but high salt should be limited.","safe","Often better tolerated by cats due to lower lactose, but still should be limited.","EU food labels"
"curd_cheese","A fresh cheese made from curdled milk.","Used in spreads, desserts, and traditional dishes.","Very popular in Central and Eastern Europe.","safe","High in protein and relatively light, but still contains lactose which may cause discomfort in sensitive people.","safe","Safe for dogs in small amounts.","caution","Cats may have trouble digesting lactose, leading to mild stomach upset.","EU food labels"
