ingredient_key,what_is_it,why_used,fun_fact,risk_label_human,health_impact_human,risk_label_dog,health_impact_dog,risk_label_cat,health_impact_cat,source
carbamide,"A chemical compound also known as urea.","It is used in some baking processes.","It is also widely known for use in fertilizers.","caution","Highly regulated and rarely used in modern food products.","avoid","Not recommended for dogs.","avoid","Not recommended for cats.","HealthyWhooo profile v1"
chlorine_dioxide,"A chemical used in food processing, mainly for flour treatment.","It helps improve color and consistency.","It is strictly controlled and used only in very small amounts.","limit","Highly regulated and often avoided due to processing concerns.","avoid","Not recommended for dogs.","avoid","Not recommended for cats.","HealthyWhooo profile v1"
propane,"A gas used as a propellant in food sprays.","It helps release oils or products from containers.","It is used in very small amounts and does not remain in the final food.","caution","Approved in specific uses, mainly for processing.","safe","Safe for dogs due to negligible exposure.","safe","Safe for cats due to negligible exposure.","HealthyWhooo profile v1"
butane,"A gas used as a propellant in food sprays.","It helps dispense products evenly from containers.","It evaporates quickly and is not present in the final product.","caution","Approved in controlled uses.","safe","Safe for dogs due to negligible exposure.","safe","Safe for cats due to negligible exposure.","HealthyWhooo profile v1"
isobutane,"A propellant gas used in aerosol food products.","It helps spray oils and creams.","It evaporates during use and does not remain in food.","caution","Approved in controlled applications.","safe","Safe for dogs due to minimal exposure.","safe","Safe for cats due to minimal exposure.","HealthyWhooo profile v1"
nitrous_oxide,"A gas used to create whipped textures in food.","It is used in whipped cream dispensers.","It is also known as laughing gas.","caution","Generally safe in food use, but used only for processing.","safe","Safe for dogs due to negligible exposure.","safe","Safe for cats due to negligible exposure.","HealthyWhooo profile v1"
nitrogen,"An inert gas used in food packaging.","It helps protect food from oxygen and keeps it fresh longer.","It is often used in snack packaging to prevent chips from going stale.","safe","Generally safe and used only for packaging, not as food itself.","safe","Safe for dogs due to indirect exposure.","safe","Safe for cats due to indirect exposure.","HealthyWhooo profile v1"
argon,"An inert gas used to preserve food freshness.","It protects products from oxidation.","It is commonly used in wine storage to keep flavor stable.","safe","Generally safe and used in packaging processes.","safe","Safe for dogs due to indirect exposure.","safe","Safe for cats due to indirect exposure.","HealthyWhooo profile v1"
helium,"A noble gas used in specialized food processing.","It helps control certain packaging environments.","It is better known for balloons than food use.","safe","Generally safe and used only in processing.","safe","Safe for dogs due to negligible exposure.","safe","Safe for cats due to negligible exposure.","HealthyWhooo profile v1"
oxygen,"A natural gas used in food packaging.","It helps control freshness and shelf life.","It is essential for life but carefully managed in food packaging.","safe","Generally safe and part of controlled packaging systems.","safe","Safe for dogs.","safe","Safe for cats.","HealthyWhooo profile v1"
hydrogen,"A gas used in food processing.","It is mainly used to modify fats during production.","This process can change the texture and stability of oils.","caution","Used in processing rather than present in final food.","safe","Safe for dogs due to minimal exposure.","safe","Safe for cats due to minimal exposure.","HealthyWhooo profile v1"
l_cysteine,"An amino acid used in baking.","It helps make dough softer and easier to handle.","It is often produced through fermentation processes.","caution","Approved, but often seen as a processing aid.","safe","Safe for dogs in small amounts.","safe","Safe for cats in small amounts.","HealthyWhooo profile v1"
invertase,"An enzyme that breaks down sugar.","It is used to create soft or liquid fillings inside candies.","It is the reason some chocolates have a soft center over time.","safe","Generally safe and used in food processing.","safe","Safe for dogs in small amounts.","safe","Safe for cats in small amounts.","HealthyWhooo profile v1"
lysozyme,"An enzyme with antibacterial properties.","It is used to help preserve certain foods like cheese.","It is often derived from egg, which matters for allergies.","caution","Generally safe, but important for people with egg allergies.","caution","Safe for dogs, but derived from egg.","caution","Safe for cats, but derived from egg.","HealthyWhooo profile v1"
quillaia_extract,"A plant extract used to create foam in drinks.","It helps beverages maintain a stable foam layer.","It is made from the bark of the quillaja tree.","caution","Approved in small amounts, mainly for texture and appearance.","safe","Safe for dogs in small amounts.","safe","Safe for cats in small amounts.","HealthyWhooo profile v1"
polyvinylpyrrolidone,"A synthetic stabilizer used in food processing.","It helps clarify beverages like beer and wine.","It is often removed after processing and not present in final product.","caution","Approved as processing aid, but not a nutritional ingredient.","safe","Safe for dogs due to minimal exposure.","safe","Safe for cats due to minimal exposure.","HealthyWhooo profile v1"
polyvinylpolypyrrolidone,"A synthetic polymer used in beverage processing.","It helps remove unwanted particles to make drinks clear.","It is commonly used in beer and wine production.","caution","Used mainly during processing and not meant as a food ingredient.","safe","Safe for dogs due to minimal exposure.","safe","Safe for cats due to minimal exposure.","HealthyWhooo profile v1"
polyvinyl_alcohol,"A synthetic polymer used in coatings and processing.","It helps stabilize products and form protective layers.","It is also used in packaging and non-food applications.","caution","Approved under limits, but highly processed.","safe","Safe for dogs in trace amounts.","safe","Safe for cats in trace amounts.","HealthyWhooo profile v1"
pullulan,"A natural substance made through fermentation.","It forms thin, edible films and coatings.","It is often used in capsules and food coatings.","safe","Generally safe and naturally derived.","safe","Safe for dogs in small amounts.","safe","Safe for cats in small amounts.","HealthyWhooo profile v1"
glycerol,"A syrup-like ingredient that helps retain moisture.","It keeps foods soft and prevents them from drying out.","It is also widely used in cosmetics and skincare.","safe","Generally safe and widely used.","safe","Safe for dogs in small amounts.","safe","Safe for cats in small amounts.","HealthyWhooo profile v1"
mannitol,"A sugar alcohol used as a sweetener.","It provides sweetness with fewer calories than sugar.","Large amounts can cause digestive discomfort.","caution","Generally safe, but may cause bloating or laxative effects.","caution","Safe for dogs in small amounts, but not beneficial.","caution","Safe for cats in small amounts, but not useful nutritionally.","HealthyWhooo profile v1"
sorbitol,"A sugar alcohol that adds sweetness and moisture.","It helps keep foods soft and slightly sweet.","Too much can lead to digestive discomfort.","caution","Generally safe, but high intake may cause bloating.","caution","Safe for dogs in small amounts, but unnecessary.","caution","Safe for cats in small amounts and not beneficial.","HealthyWhooo profile v1"
gellan_gum,"A thickener produced by fermentation.","It helps create gels and stabilize food textures.","It is often used in plant-based milks and desserts.","safe","Generally safe and widely used.","safe","Safe for dogs in small amounts.","safe","Safe for cats in small amounts.","HealthyWhooo profile v1"
tara_gum,"A plant-based thickener made from tara seeds.","It improves texture and stability in foods.","It works similarly to other plant gums.","safe","Generally safe and naturally derived.","safe","Safe for dogs in small amounts.","safe","Safe for cats in small amounts.","HealthyWhooo profile v1"
karaya_gum,"A natural gum extracted from tree sap.","It is used to thicken and stabilize foods.","It has been used in food for many years.","safe","Generally safe and naturally derived.","safe","Safe for dogs in small amounts.","safe","Safe for cats in small amounts.","HealthyWhooo profile v1"
xanthan_gum,"A thickener made through fermentation.","It helps foods stay smooth and evenly mixed.","It is very common in gluten-free and processed foods.","safe","Generally safe, though some people prefer to limit gums.","safe","Safe for dogs in small amounts.","safe","Safe for cats in small amounts.","HealthyWhooo profile v1"
gum_arabic,"A natural gum from acacia trees.","It is used to stabilize drinks and sweets.","It has been used in food for centuries.","safe","Generally safe and naturally derived.","safe","Safe for dogs in small amounts.","safe","Safe for cats in small amounts.","HealthyWhooo profile v1"
tragacanth,"A natural plant gum used as thickener.","It improves texture and consistency in foods.","It has been used since ancient times.","safe","Generally safe and naturally derived.","safe","Safe for dogs in small amounts.","safe","Safe for cats in small amounts.","HealthyWhooo profile v1"
guar_gum,"A fiber from guar beans used as thickener.","It helps foods stay smooth and consistent.","It can absorb large amounts of water.","caution","Generally safe, but sometimes limited in highly processed foods.","safe","Safe for dogs in small amounts.","safe","Safe for cats in small amounts.","HealthyWhooo profile v1"
locust_bean_gum,"A plant gum from carob seeds.","It is used to thicken and stabilize foods.","It is common in ice cream and dairy desserts.","safe","Generally safe and widely used.","safe","Safe for dogs in small amounts.","safe","Safe for cats in small amounts.","HealthyWhooo profile v1"
processed_eucheuma_seaweed,"A seaweed-based thickener similar to carrageenan.","It helps create smooth textures in food.","It is often discussed together with carrageenan.","caution","Approved, but sometimes debated in digestion discussions.","caution","Safe for dogs in small amounts, but sensitive animals may react.","caution","Safe for cats in small amounts, but may affect sensitive digestion.","HealthyWhooo profile v1"
carrageenan,"A thickener made from red seaweed.","It is used to stabilize dairy and plant-based products.","It is widely used but sometimes debated.","caution","Approved, but some people prefer to limit it.","caution","Safe for dogs in small amounts, but may affect sensitive stomachs.","caution","Safe for cats in small amounts, but may affect digestion.","HealthyWhooo profile v1"
agar,"A gel-forming substance from algae.","It is used as a plant-based alternative to gelatin.","It creates firm textures in desserts.","safe","Generally safe and naturally derived.","safe","Safe for dogs in small amounts.","safe","Safe for cats in small amounts.","HealthyWhooo profile v1"
propane_alginate,"A modified seaweed-based thickener.","It improves stability and texture in foods.","It is more processed than natural alginates.","caution","Approved, but considered a more processed additive.","safe","Safe for dogs in small amounts.","safe","Safe for cats in small amounts.","HealthyWhooo profile v1"
calcium_alginate,"A salt derived from seaweed.","It is used to form gels and stabilize foods.","It is often used in modern cooking techniques.","safe","Generally safe and naturally derived.","safe","Safe for dogs in small amounts.","safe","Safe for cats in small amounts.","HealthyWhooo profile v1"
ammonium_alginate,"A derivative of alginic acid from seaweed.","It is used as a stabilizer in foods.","It helps maintain texture and consistency.","safe","Generally safe and widely used.","safe","Safe for dogs in small amounts.","safe","Safe for cats in small amounts.","HealthyWhooo profile v1"
potassium_alginate,"A thickener derived from seaweed.","It is used to create gels and stabilize foods.","It is often used in modern food techniques.","safe","Generally safe and naturally derived.","safe","Safe for dogs in small amounts.","safe","Safe for cats in small amounts.","HealthyWhooo profile v1"
sodium_alginate,"A seaweed-based thickener.","It forms gels when combined with calcium.","It is widely used in molecular gastronomy.","safe","Generally safe and widely used.","safe","Safe for dogs in small amounts.","safe","Safe for cats in small amounts.","HealthyWhooo profile v1"
alginic_acid,"A natural substance from seaweed.","It is used to thicken and stabilize foods.","It helps improve texture in products like ice cream.","safe","Generally safe and naturally derived.","safe","Safe for dogs in small amounts.","safe","Safe for cats in small amounts.","HealthyWhooo profile v1"
rosemary_extract,"A plant extract from rosemary.","It is used as a natural antioxidant to keep food fresh.","It helps prevent oils from going rancid.","safe","Generally safe and often seen as a natural alternative to synthetic preservatives.","safe","Safe for dogs in small amounts.","safe","Safe for cats in small amounts.","HealthyWhooo profile v1"
calcium_disodium_edta,"A compound that binds metals in food.","It helps preserve color, flavor, and stability.","It is often used in canned and processed foods.","caution","Approved in small amounts, but clearly a processing additive.","safe","Safe for dogs in small amounts.","safe","Safe for cats in small amounts.","HealthyWhooo profile v1"
triammonium_citrate,"A salt derived from citric acid.","It is used to regulate acidity in foods.","It helps balance taste and stability.","safe","Generally safe and widely used.","safe","Safe for dogs in small amounts.","safe","Safe for cats in small amounts.","HealthyWhooo profile v1"
succinic_acid,"An organic acid found naturally in plants.","It adds a mild sour taste to foods.","It also occurs naturally in the body.","safe","Generally safe and naturally occurring.","safe","Safe for dogs in small amounts.","safe","Safe for cats in small amounts.","HealthyWhooo profile v1"
potassium_adipate,"A salt used to control acidity.","It helps balance flavor in food products.","It is commonly used in drinks and powdered foods.","safe","Generally safe and used in controlled amounts.","safe","Safe for dogs in small amounts.","safe","Safe for cats in small amounts.","HealthyWhooo profile v1"
sodium_adipate,"A salt of adipic acid used in food.","It helps regulate acidity and taste.","It is often used in powdered drink mixes.","safe","Generally safe and widely used.","safe","Safe for dogs in small amounts.","safe","Safe for cats in small amounts.","HealthyWhooo profile v1"
adipic_acid,"A synthetic acid used to add sour taste.","It helps control acidity in processed foods.","It is commonly used in powdered and flavored products.","caution","Approved, but considered a more processed additive.","safe","Safe for dogs in small amounts.","safe","Safe for cats in small amounts.","HealthyWhooo profile v1"
calcium_tartrate,"A mineral salt derived from tartaric acid.","It is used to regulate acidity and improve texture in foods.","It occurs naturally in grapes and wine.","safe","Generally safe and naturally occurring.","safe","Safe for dogs in small amounts.","safe","Safe for cats in small amounts.","HealthyWhooo profile v1"
metatartaric_acid,"A modified form of tartaric acid.","It helps prevent crystals from forming in products like wine.","It is commonly used to keep liquids smooth and stable.","safe","Generally safe and used in controlled amounts.","safe","Safe for dogs in small amounts.","safe","Safe for cats in small amounts.","HealthyWhooo profile v1"
calcium_malate,"A salt of malic acid found in fruits.","It is used to regulate acidity in foods.","It contributes to a mild, pleasant tart taste.","safe","Generally safe and naturally related to fruit acids.","safe","Safe for dogs in small amounts.","safe","Safe for cats in small amounts.","HealthyWhooo profile v1"
potassium_malate,"A potassium salt of malic acid.","It helps balance acidity and flavor in foods.","It is commonly used in beverages.","safe","Generally safe and widely used.","safe","Safe for dogs in small amounts.","safe","Safe for cats in small amounts.","HealthyWhooo profile v1"
sodium_malate,"A sodium salt of malic acid.","It is used to regulate acidity and improve taste.","It is often used in drinks and processed foods.","safe","Generally safe and commonly used.","safe","Safe for dogs in small amounts.","safe","Safe for cats in small amounts.","HealthyWhooo profile v1"
magnesium_phosphate,"A mineral salt used in food.","It helps regulate acidity and stabilize products.","It can also contribute magnesium to the diet.","safe","Generally safe and sometimes nutritionally beneficial.","safe","Safe for dogs in small amounts.","safe","Safe for cats in small amounts.","HealthyWhooo profile v1"
tricalcium_phosphate,"A calcium-based mineral salt.","It is used to prevent clumping and add calcium.","It is often found in powdered foods.","safe","Generally safe and can support calcium intake.","safe","Safe for dogs and may support bone health.","safe","Safe for cats in small amounts.","HealthyWhooo profile v1"
potassium_phosphate,"A group of mineral salts used in food.","They help regulate acidity and stabilize products.","They are widely used in processed foods.","safe","Generally safe in moderate amounts.","safe","Safe for dogs in small amounts.","safe","Safe for cats in small amounts.","HealthyWhooo profile v1"
sodium_phosphate,"A group of phosphate salts used in food.","They help control acidity and improve texture.","High intake is sometimes discussed in nutrition.","caution","Generally safe, but high consumption may be a concern.","caution","Safe for dogs in small amounts, but not needed.","caution","Safe for cats in small amounts and not beneficial.","HealthyWhooo profile v1"
phosphoric_acid,"A mineral acid used in food and drinks.","It adds a sharp, tangy taste.","It is especially common in cola drinks.","caution","Approved, but often limited in highly processed beverages.","caution","Safe for dogs in small amounts, but unnecessary.","caution","Safe for cats in small amounts and not beneficial.","HealthyWhooo profile v1"
sodium_potassium_tartrate,"A salt derived from tartaric acid.","It is used to regulate acidity in food.","It is also known as Rochelle salt and linked to grapes and wine.","safe","Generally safe and naturally related to fruit acids.","safe","Safe for dogs in small amounts.","safe","Safe for cats in small amounts.","HealthyWhooo profile v1"
potassium_tartrate,"A potassium salt of tartaric acid.","It helps control acidity and is used in baking.","It is commonly associated with wine production.","safe","Generally safe and naturally derived.","safe","Safe for dogs in small amounts.","safe","Safe for cats in small amounts.","HealthyWhooo profile v1"
sodium_tartrate,"A sodium salt of tartaric acid.","It is used to regulate acidity and stabilize foods.","It is naturally related to compounds found in grapes.","safe","Generally safe and widely used.","safe","Safe for dogs in small amounts.","safe","Safe for cats in small amounts.","HealthyWhooo profile v1"
potassium_chloride,"A mineral salt containing potassium.","It is often used as a salt substitute or to regulate acidity.","It is commonly used in low-sodium products.","safe","Generally safe and can help reduce sodium intake.","safe","Safe for dogs in small amounts.","safe","Safe for cats in small amounts.","HealthyWhooo profile v1"
calcium_chloride,"A mineral salt used to keep foods firm.","It helps maintain texture in products like canned vegetables.","It is often used to keep pickles crunchy.","safe","Generally safe and widely used.","safe","Safe for dogs in small amounts.","safe","Safe for cats in small amounts.","HealthyWhooo profile v1"
magnesium_chloride,"A mineral salt containing magnesium.","It is used to regulate acidity and stabilize foods.","It is also used in tofu production.","safe","Generally safe and may provide minerals.","safe","Safe for dogs in small amounts.","safe","Safe for cats in small amounts.","HealthyWhooo profile v1"
stannous_chloride,"A compound containing tin.","It is used to stabilize color in some foods.","It is approved only in very small amounts.","caution","Highly controlled and used in limited applications.","caution","Safe for dogs in very small amounts, but not beneficial.","caution","Safe for cats in very small amounts and not useful nutritionally.","HealthyWhooo profile v1"
sulphuric_acid,"A strong acid used in food processing.","It is highly diluted and used to control acidity.","Despite the name, it is used in very controlled and safe amounts.","caution","Approved in very small, controlled amounts.","caution","Safe for dogs only in trace processed amounts.","caution","Safe for cats only in trace processed amounts.","HealthyWhooo profile v1"
sodium_sulphates,"Salts derived from sulphuric acid.","They are used to regulate acidity in food.","They also occur naturally in minerals.","safe","Generally safe and widely used.","safe","Safe for dogs in small amounts.","safe","Safe for cats in small amounts.","HealthyWhooo profile v1"
potassium_sulphates,"Mineral salts containing potassium.","They help regulate acidity and stabilize foods.","They are also used outside food, such as in agriculture.","safe","Generally safe and used in controlled amounts.","safe","Safe for dogs in small amounts.","safe","Safe for cats in small amounts.","HealthyWhooo profile v1"
calcium_sulphate,"A mineral salt also known as gypsum.","It is used to improve texture and stability in foods.","It is the same mineral used in construction materials, but food-grade and purified.","safe","Generally safe and widely used in small amounts.","safe","Safe for dogs in small amounts.","safe","Safe for cats in small amounts.","HealthyWhooo profile v1"
ammonium_sulphate,"A compound containing ammonium.","It is used to regulate acidity in foods.","It is also commonly used in fertilizers outside the food industry.","caution","Approved in small amounts, but clearly a processing additive.","caution","Safe for dogs in small amounts, but not beneficial.","caution","Safe for cats in small amounts and not useful nutritionally.","HealthyWhooo profile v1"
aluminium_sulphate,"A mineral compound containing aluminium.","It is used in food processing and water purification.","It is strictly regulated due to aluminium content.","limit","Highly controlled and often limited in food use.","caution","Not recommended for dogs beyond trace exposure.","caution","Not recommended for cats beyond trace exposure.","HealthyWhooo profile v1"
aluminium_sodium_sulphate,"A compound of aluminium and sodium.","It is used as a firming agent in some foods.","It is strictly regulated and used in limited applications.","limit","Highly controlled due to aluminium content.","caution","Not recommended for dogs beyond trace exposure.","caution","Not recommended for cats beyond trace exposure.","HealthyWhooo profile v1"
aluminium_potassium_sulphate,"A mineral salt also known as alum.","It is used in some food processes and baking.","It is strictly regulated due to aluminium content.","limit","Highly controlled and limited in use.","caution","Not recommended for dogs beyond trace exposure.","caution","Not recommended for cats beyond trace exposure.","HealthyWhooo profile v1"
aluminium_ammonium_sulphate,"A compound containing aluminium and ammonium.","It is used in very limited food applications.","It is rarely seen in modern food products.","limit","Highly regulated and rarely used.","caution","Not recommended for dogs.","caution","Not recommended for cats.","HealthyWhooo profile v1"
sodium_hydroxide,"A strong alkaline compound also known as lye.","It is used to adjust acidity and process foods.","It is used in traditional foods like pretzels and olives.","caution","Safe in controlled use, but highly reactive in pure form.","safe","Safe for dogs in processed food amounts.","safe","Safe for cats in processed food amounts.","HealthyWhooo profile v1"
potassium_hydroxide,"A strong alkaline compound.","It is used to regulate acidity in food processing.","It is used in products like cocoa and chocolate processing.","caution","Approved in small amounts, mainly for processing.","safe","Safe for dogs in small amounts.","safe","Safe for cats in small amounts.","HealthyWhooo profile v1"
calcium_hydroxide,"A mineral compound used to regulate acidity.","It helps improve texture in certain foods.","It is used in traditional processes like corn preparation.","safe","Generally safe and widely used.","safe","Safe for dogs in small amounts.","safe","Safe for cats in small amounts.","HealthyWhooo profile v1"
ammonium_hydroxide,"A solution of ammonia in water.","It is used to regulate acidity in food processing.","It is used in very controlled amounts.","caution","Approved in limited uses and highly regulated.","caution","Safe for dogs in trace amounts.","caution","Safe for cats in trace amounts.","HealthyWhooo profile v1"
magnesium_hydroxide,"A magnesium-based compound.","It is used to regulate acidity in food.","It is also commonly used as an antacid in medicine.","safe","Generally safe and sometimes beneficial in small amounts.","safe","Safe for dogs in small amounts.","safe","Safe for cats in small amounts.","HealthyWhooo profile v1"
