ingredient_key,what_is_it,why_used,fun_fact,risk_label_human,health_impact_human,risk_label_dog,health_impact_dog,risk_label_cat,health_impact_cat,source
egg_white,"The clear protein part of the egg.","Used in baking and light recipes like meringue.","Almost pure protein.","safe","Low in fat and high in protein; generally very healthy.","safe","Safe for dogs when cooked.","safe","Safe for cats when cooked.","EU food labels"
egg_yolk,"The yellow part of the egg rich in fats and nutrients.","Used in sauces, baking, and dressings.","Gives eggs their color and richness.","caution","Contains vitamins and healthy fats, but also cholesterol; best in moderation.","safe","Safe for dogs when cooked.","safe","Safe for cats when cooked.","EU food labels"
wheat,"A widely used cereal grain.","Used to make flour, bread, and many processed foods.","One of the most important global crops.","caution","Contains gluten, which may not be suitable for people with gluten intolerance or celiac disease.","safe","Safe for dogs in small amounts.","safe","Safe for cats in small amounts.","EU food labels"
wheat_flour,"A flour made from ground wheat grains.","Used in bread, baking, and many processed foods.","The most common flour used worldwide.","caution","Contains gluten, which may not be suitable for people with gluten intolerance or celiac disease.","safe","Safe for dogs in small amounts.","safe","Safe for cats in small amounts.","EU food labels"
whole_wheat_flour,"Flour made from the entire wheat grain.","Used in wholegrain bread and baking.","Keeps more nutrients than white flour.","caution","Contains gluten, which may not be suitable for people with gluten intolerance or celiac disease.","safe","Safe for dogs in small amounts.","safe","Safe for cats in small amounts.","EU food labels"
rye,"A cereal grain often used in dark breads.","Used in traditional baked goods.","Common in Northern and Eastern Europe.","caution","Contains gluten, which may not be suitable for people with gluten intolerance or celiac disease.","safe","Safe for dogs in small amounts.","safe","Safe for cats in small amounts.","EU food labels"
rye_flour,"Flour made from ground rye grains.","Used in breads and traditional baking.","Gives a dense texture and strong flavor.","caution","Contains gluten, which may not be suitable for people with gluten intolerance or celiac disease.","safe","Safe for dogs in small amounts.","safe","Safe for cats in small amounts.","EU food labels"
barley,"A cereal grain used in food and drinks.","Used in soups, cereals, and brewing.","One of the oldest cultivated grains.","caution","Contains gluten, which may not be suitable for people with gluten intolerance or celiac disease.","safe","Safe for dogs in small amounts.","safe","Safe for cats in small amounts.","EU food labels"
barley_malt,"Sprouted barley processed to enhance flavor.","Used in cereals, sweets, and beverages.","Key ingredient in beer production.","caution","Contains gluten, which may not be suitable for people with gluten intolerance or celiac disease.","safe","Safe for dogs in small amounts.","safe","Safe for cats in small amounts.","EU food labels"
oats,"Whole grains commonly eaten as oatmeal.","Used in breakfast foods and baking.","A classic healthy breakfast ingredient.","safe","Naturally gluten-free, but may contain gluten unless certified gluten-free.","safe","Safe for dogs and often used in pet food.","safe","Safe for cats in small amounts.","EU food labels"
oat_flour,"Flour made from ground oats.","Used in baking and gluten-free recipes.","Popular in healthier baking.","safe","Naturally gluten-free, but may contain gluten unless certified gluten-free.","safe","Safe for dogs in small amounts.","safe","Safe for cats in small amounts.","EU food labels"
rice,"A staple grain eaten around the world.","Used in countless dishes and products.","Feeds billions of people daily.","safe","Naturally gluten-free and easy to digest; a good energy source.","safe","Safe for dogs and easy on digestion.","safe","Safe for cats in small amounts.","EU food labels"
rice_flour,"Flour made from finely ground rice.","Used in gluten-free baking and cooking.","Common in Asian cuisine.","safe","Naturally gluten-free and gentle on digestion.","safe","Safe for dogs in small amounts.","safe","Safe for cats in small amounts.","EU food labels
cornmeal,"Coarsely ground corn with a slightly gritty texture.","Used in baking, porridge, and dishes like polenta.","A traditional staple in many cultures.","safe","Naturally gluten-free and a good energy source, but mostly carbohydrates.","safe","Safe for dogs in small amounts.","safe","Safe for cats in small amounts.","EU food labels"
semolina,"A coarse flour made from durum wheat.","Used in pasta, desserts, and porridge.","Gives pasta its firm texture.","caution","Contains gluten, which may not be suitable for people with gluten intolerance or celiac disease.","safe","Safe for dogs in small amounts.","safe","Safe for cats in small amounts.","EU food labels"
vegetable_oil,"A general term for oils made from plants.","Used for frying, cooking, and in processed foods.","The exact source is often not specified.","caution","Generally safe, but highly processed versions and high intake may impact health.","safe","Safe for dogs in small amounts.","safe","Safe for cats in small amounts.","EU food labels"
sunflower_oil,"Oil extracted from sunflower seeds.","Used for cooking and frying.","Known for its light taste.","safe","Rich in unsaturated fats, but should be balanced with other fats.","safe","Safe for dogs in small amounts.","safe","Safe for cats in small amounts.","EU food labels"
rapeseed_oil,"Oil made from rapeseed, also known as canola oil.","Used widely in cooking and processed foods.","Very common in Europe.","safe","Balanced fat profile and generally considered a healthy cooking oil.","safe","Safe for dogs in small amounts.","safe","Safe for cats in small amounts.","EU food labels"
olive_oil,"Oil pressed from olives.","Used in cooking, salads, and dressings.","A key part of the Mediterranean diet.","safe","Rich in healthy fats and antioxidants; supports heart health when used in moderation.","safe","Safe for dogs in small amounts.","safe","Safe for cats in small amounts.","EU food labels"
extra_virgin_olive_oil,"A high-quality olive oil made without heavy processing.","Used in salads and light cooking.","Known for its rich flavor.","safe","Contains antioxidants and healthy fats; often considered one of the healthiest oils.","safe","Safe for dogs in small amounts.","safe","Safe for cats in small amounts.","EU food labels"
palm_oil,"An oil made from palm fruit.","Used in many processed foods for stability.","Often discussed due to environmental concerns.","limit","High in saturated fat; frequent consumption may impact heart health.","safe","Safe for dogs in small amounts.","safe","Safe for cats in small amounts.","EU food labels"
coconut_oil,"An oil made from coconut flesh.","Used in cooking, baking, and sweets.","Solid at room temperature.","caution","Very high in saturated fat; occasional use is fine, but not ideal in large amounts.","safe","Safe for dogs in small amounts.","safe","Safe for cats in small amounts.","EU food labels"
butterfat,"The pure fat portion of butter.","Used to add richness to foods and dairy products.","Responsible for buttery flavor.","limit","Very high in saturated fat; excessive intake may affect heart health.","safe","Safe for dogs in small amounts.","caution","High fat may upset a cat’s digestion.","EU food labels
milk_protein,"Protein extracted from milk and added to foods.","Used to boost protein content in processed and fitness products.","Common in protein bars and shakes.","caution","Good protein source, but may trigger milk allergies or intolerance in some people.","safe","Safe for dogs in small amounts.","caution","May be harder for some cats to digest.","EU food labels"
whey,"A liquid byproduct left after cheese production.","Used in protein powders and processed foods.","Very popular in sports nutrition.","caution","Rich in protein, but contains lactose which may cause bloating or discomfort.","safe","Safe for dogs in small amounts.","caution","Cats may have trouble digesting lactose.","EU food labels"
sugar,"A common sweetener made from sugar beet or cane.","Used to sweeten foods and drinks.","One of the most widely used ingredients worldwide.","caution","High intake may lead to weight gain, blood sugar spikes, and dental issues.","safe","Safe for dogs in very small amounts, but not recommended regularly.","caution","Not suitable for cats; offers no benefit and may upset metabolism.","EU food labels"
cane_sugar,"Sugar extracted from sugar cane.","Used in sweets, drinks, and desserts.","Often seen as more 'natural' but works the same as regular sugar.","caution","Still sugar; excessive intake may impact blood sugar and overall health.","safe","Safe for dogs only in very small amounts.","caution","Not recommended for cats due to sugar sensitivity.","EU food labels"
beet_sugar,"Sugar made from sugar beets.","Used widely in processed foods.","Main sugar source in many European products.","caution","Same effects as regular sugar; high intake may affect metabolism and teeth.","safe","Safe for dogs only in very small amounts.","caution","Not suitable for cats.","EU food labels"
brown_sugar,"Sugar that contains molasses, giving it a darker color.","Used in baking and desserts.","Adds a slight caramel flavor.","caution","Still high in sugar; no major health advantage over white sugar.","safe","Safe for dogs only in very small amounts.","caution","Not suitable for cats.","EU food labels"
powdered_sugar,"Very fine sugar often used in icing and desserts.","Used in cakes, pastries, and decorations.","Dissolves instantly in liquids.","caution","Pure sugar; can quickly spike blood sugar and should be limited.","safe","Safe for dogs only in very small amounts.","caution","Not suitable for cats.","EU food labels"
glucose,"A simple sugar used in many processed foods.","Used as a quick energy source and sweetener.","Also known as dextrose.","caution","Raises blood sugar quickly; frequent intake may impact metabolic health.","safe","Safe for dogs in very small amounts.","caution","Not suitable for cats.","EU food labels"
fructose,"A natural sugar found in fruits.","Used as a sweetener in processed foods.","Sweeter than glucose.","caution","High intake (especially added fructose) may affect liver metabolism and weight.","safe","Safe for dogs in small amounts.","caution","Not ideal for cats.","EU food labels"
glucose_syrup,"A liquid sweetener made from starch.","Used in candies, baked goods, and processed foods.","Helps keep products soft and moist.","caution","High in sugar and quickly absorbed; frequent intake may affect blood sugar.","safe","Safe for dogs in very small amounts.","caution","Not suitable for cats.","EU food labels
invert_sugar,"A mix of glucose and fructose created by breaking down regular sugar.","Used in sweets to keep them soft and moist.","Common in candies and baked goods.","caution","High in sugar and quickly absorbed; frequent intake may affect blood sugar and teeth.","safe","Safe for dogs only in very small amounts.","caution","Not suitable for cats due to sugar content.","EU food labels"
honey,"A natural sweet substance made by bees from nectar.","Used in drinks, desserts, and natural remedies.","Known for its long shelf life.","caution","Contains antioxidants but still very high in sugar; should be used in moderation.","safe","Safe for dogs in small amounts.","caution","Not ideal for cats; high sugar offers no benefit.","EU food labels"
maple_syrup,"A sweet syrup made from maple tree sap.","Used on pancakes, desserts, and in baking.","Popular in North America.","caution","Contains some minerals but still high in sugar; frequent use may affect blood sugar.","safe","Safe for dogs in very small amounts.","caution","Too sugary for cats.","EU food labels"
agave_syrup,"A sweet syrup extracted from the agave plant.","Used as a sugar alternative in foods and drinks.","Often marketed as a 'natural' sweetener.","caution","Very high in fructose, which may impact metabolism when consumed in excess.","safe","Safe for dogs only in small amounts.","caution","Not recommended for cats.","EU food labels"
molasses,"A dark syrup left after sugar production.","Used in baking and traditional recipes.","Has a strong, rich flavor.","caution","Contains some minerals but still high in sugar; excessive intake may affect health.","safe","Safe for dogs in small amounts.","caution","Not suitable for cats due to sugar content.","EU food labels"
caramelized_sugar,"Sugar that has been heated until it turns brown and develops flavor.","Used for color and taste in desserts and sauces.","Gives foods a deep caramel flavor.","caution","Still sugar; may contribute to blood sugar spikes and dental issues.","safe","Safe for dogs in very small amounts.","caution","Not suitable for cats.","EU food labels"
cocoa,"A powder made from ground cocoa beans.","Used in chocolate and desserts.","The base ingredient of all chocolate.","safe","Rich in antioxidants, but pure cocoa is bitter and often paired with sugar.","caution","Cocoa can be harmful to dogs and should be avoided.","caution","Toxic to cats and should be avoided.","EU food labels"
cocoa_powder,"Finely ground cocoa used in baking and drinks.","Used in cakes, hot chocolate, and desserts.","Gives chocolate its deep flavor.","safe","Contains antioxidants, but often consumed with sugar in products.","caution","Toxic to dogs due to compounds like theobromine.","caution","Toxic to cats and unsafe.","EU food labels"
cocoa_mass,"Ground cocoa beans forming the base of chocolate.","Used in chocolate production.","Contains both cocoa solids and cocoa butter.","safe","Source of antioxidants, but usually combined with sugar and fat in chocolate.","caution","Toxic to dogs and should not be consumed.","caution","Toxic to cats.","EU food labels"
cocoa_butter,"Natural fat extracted from cocoa beans.","Used to give chocolate its smooth texture.","Melts just below body temperature.","safe","High in fat but generally safe in moderation.","caution","Safe in tiny amounts, but chocolate products can be dangerous for dogs.","caution","Not safe when part of chocolate; may harm cats.","EU food labels"}
dark_chocolate,"Chocolate with a high cocoa content and less sugar.","Used in desserts, baking, and snacks.","Often seen as a richer and more intense chocolate.","caution","Contains antioxidants, but also caffeine-like compounds; best in moderation.","limit","Toxic to dogs due to theobromine and can be very dangerous.","limit","Toxic to cats and should be avoided.","EU food labels"
milk_chocolate,"Chocolate made with cocoa, milk, and sugar.","Used in sweets, snacks, and desserts.","The most popular type of chocolate worldwide.","limit","High in sugar and fat; easy to overconsume and not ideal for daily intake.","limit","Toxic to dogs and may cause serious health issues.","limit","Toxic to cats.","EU food labels"
white_chocolate,"Chocolate made from cocoa butter, sugar, and milk, without cocoa solids.","Used in desserts and confectionery.","Does not contain cocoa powder.","limit","Very high in sugar and fat with little nutritional value.","caution","Not as toxic as dark chocolate, but still unhealthy and not recommended.","caution","Too sugary and fatty for cats.","EU food labels"
vanilla,"A natural aromatic spice from vanilla orchids.","Used to flavor desserts, drinks, and sweets.","One of the most expensive spices in the world.","safe","Generally safe and used in very small amounts; adds flavor without health impact.","safe","Safe for dogs in small amounts.","safe","Safe for cats in small amounts.","EU food labels"
vanilla_extract,"A liquid extract made from vanilla beans.","Used in baking and desserts for flavor.","A little goes a long way.","safe","Safe in small culinary amounts, but contains alcohol so should not be consumed in large quantities.","caution","Small amounts in food are usually safe, but concentrated extract (alcohol) should be avoided.","caution","Not ideal for cats due to alcohol content in extract form.","EU food labels"
vanilla_pods,"Whole dried vanilla beans used for flavor.","Used in high-quality desserts and cooking.","Tiny seeds inside are very aromatic.","safe","Natural and safe; mainly used for flavor in small amounts.","safe","Safe for dogs in small amounts.","safe","Safe for cats in small amounts.","EU food labels"
cinnamon,"A spice made from the inner bark of trees.","Used in desserts, drinks, and savory dishes.","A classic winter spice.","safe","Contains antioxidants, but large amounts may irritate the mouth or liver (especially cassia type).","caution","Safe in very small amounts, but too much may irritate dogs.","caution","May irritate cats if consumed in larger amounts.","EU food labels"
nutmeg,"A strong, warm spice from tree seeds.","Used in baking and cooking.","Very aromatic and intense.","caution","Safe in small amounts, but large doses can be toxic and affect the nervous system.","caution","Can be toxic to dogs even in moderate amounts.","caution","Toxic to cats and should be avoided.","EU food labels"
cloves,"Dried flower buds used as a spice.","Used in baking, drinks, and spice mixes.","Very strong and aromatic flavor.","safe","Contains antioxidants, but very strong; large amounts may irritate the digestive system.","caution","May irritate dogs and should be limited.","caution","Not ideal for cats; may cause irritation.","EU food labels"
ginger,"A root spice with a warm, slightly spicy taste.","Used in foods, drinks, and traditional remedies.","Common in Asian cuisine.","safe","May support digestion and reduce nausea; generally very safe.","safe","Safe for dogs in small amounts and may help digestion.","safe","Safe for cats in small amounts.","EU food labels"
turmeric,"A bright yellow spice made from a root.","Used to add color and flavor to dishes like curry.","Known for its active compound curcumin.","safe","May have anti-inflammatory benefits, but effects depend on amount and absorption.","safe","Safe for dogs in small amounts and sometimes used as a supplement.","safe","Safe for cats in small amounts.","EU food labels"
basil,"A fresh green herb with a sweet aroma.","Used in sauces, salads, and Italian dishes.","Key ingredient in pesto.","safe","Contains antioxidants and vitamins; generally very healthy.","safe","Safe for dogs in small amounts.","safe","Safe for cats in small amounts.","EU food labels"
oregano,"A fragrant herb commonly used in Mediterranean cooking.","Used in pizza, sauces, and seasoning blends.","A staple in Italian cuisine.","safe","Rich in antioxidants and may support digestion.","safe","Safe for dogs in small amounts.","safe","Safe for cats in small amounts.","EU food labels"
thyme,"A small aromatic herb with a slightly earthy flavor.","Used in soups, meats, and sauces.","Common in European cooking.","safe","Contains antioxidants and may support immunity.","safe","Safe for dogs in small amounts.","safe","Safe for cats in small amounts.","EU food labels"
rosemary,"A strong, pine-like herb used in cooking.","Used with meats, potatoes, and roasted dishes.","Popular in Mediterranean cuisine.","safe","Contains antioxidants, but large amounts may irritate digestion.","safe","Safe for dogs in small amounts.","caution","Large amounts may irritate cats.","EU food labels"
parsley,"A fresh green herb often used as garnish or ingredient.","Used in salads, soups, and sauces.","Adds color and freshness to dishes.","safe","Rich in vitamins like vitamin C and K; generally very healthy.","safe","Safe for dogs and may freshen breath.","safe","Safe for cats in small amounts.","EU food labels"
dill,"A soft herb with a light, fresh flavor.","Used in sauces, pickles, and fish dishes.","Popular in Northern and Eastern Europe.","safe","Supports digestion and adds flavor without calories.","safe","Safe for dogs in small amounts.","safe","Safe for cats in small amounts.","EU food labels"
mint,"A refreshing herb with a cool taste.","Used in drinks, desserts, and teas.","Often used for its refreshing aroma.","safe","May support digestion and freshen breath.","safe","Safe for dogs in small amounts.","safe","Safe for cats in small amounts.","EU food labels"
coriander,"A leafy herb also known as cilantro.","Used in many global cuisines.","Common in Asian and Mexican dishes.","safe","Contains antioxidants and may support digestion.","safe","Safe for dogs in small amounts.","safe","Safe for cats in small amounts.","EU food labels"
chili,"A spicy pepper used to add heat to food.","Used in sauces, spices, and many dishes.","Contains capsaicin, which gives the heat.","caution","May irritate the stomach or digestive system, especially in large amounts.","caution","Can irritate a dog’s mouth and stomach.","caution","Not suitable for cats; may cause irritation.","EU food labels"
paprika,"A spice made from dried and ground peppers.","Used to add color and mild flavor to dishes.","Can range from sweet to spicy.","safe","Rich in antioxidants and generally very safe; adds flavor without calories.","safe","Safe for dogs in small amounts.","safe","Safe for cats in small amounts.","EU food labels"
salt,"A mineral used to season and preserve food.","Used in almost all savory foods.","Essential in small amounts for body function.","caution","Too much salt may increase blood pressure and strain the heart over time.","caution","High salt intake can be harmful and lead to dehydration or sodium poisoning.","caution","Too much salt is dangerous for cats and can affect kidneys.","EU food labels"
sea_salt,"Salt obtained by evaporating seawater.","Used for seasoning and finishing dishes.","Often marketed as more 'natural'.","caution","Nutritionally similar to regular salt; excessive intake may affect blood pressure.","caution","Too much can harm dogs and cause dehydration.","caution","High salt is not suitable for cats.","EU food labels"
iodized_salt,"Salt enriched with iodine.","Used to support proper thyroid function.","Common in household salt.","caution","Helps prevent iodine deficiency, but still high in sodium and should be limited.","caution","Too much salt can harm dogs.","caution","Not suitable in large amounts for cats.","EU food labels"
vinegar,"An acidic liquid made by fermenting alcohol.","Used in dressings, pickling, and cooking.","Adds sharp flavor without calories.","safe","Very low calorie and may support digestion, but high acidity can irritate the stomach or teeth.","safe","Safe for dogs in small amounts.","caution","Too acidic for cats in larger amounts.","EU food labels"
apple_cider_vinegar,"Vinegar made from fermented apple juice.","Used in dressings and sometimes as a health drink.","Popular in wellness trends.","safe","Low calorie and may support digestion, but acidic and should be diluted.","safe","Safe for dogs in small diluted amounts.","caution","May irritate a cat’s stomach due to acidity.","EU food labels"
wine_vinegar,"Vinegar produced from fermented wine.","Used in sauces and salad dressings.","Common in Mediterranean cooking.","safe","Adds flavor without calories; acidity may irritate sensitive stomachs.","safe","Safe for dogs in small amounts.","caution","Not ideal for cats due to acidity.","EU food labels"
balsamic_vinegar,"A dark, slightly sweet vinegar made from grapes.","Used in salads, sauces, and glazes.","Traditional Italian product.","safe","Contains small amounts of natural sugar but generally safe in normal use.","safe","Safe for dogs in small amounts.","caution","May be too acidic for cats.","EU food labels"
yeast,"A microorganism used to ferment food.","Used in baking and brewing.","Responsible for making bread rise.","safe","Generally safe and essential in baking; some people may be sensitive.","safe","Safe for dogs in baked products, but raw yeast dough is dangerous.","safe","Safe for cats in small amounts when cooked.","EU food labels"
baker_yeast,"A type of yeast used specifically for baking bread.","Used to ferment dough and create air bubbles.","Helps dough rise and become fluffy.","safe","Safe in baked foods, but raw yeast dough can cause serious digestive issues.","caution","Raw yeast dough can expand in a dog’s stomach and is dangerous.","caution","Not safe for cats if raw; baked form is generally safe."
brewers_yeast,"A type of yeast used in beer production and as a supplement.","Used in brewing, seasoning, and nutritional products.","Often sold as a vitamin-rich powder or flakes.","safe","Rich in B vitamins and protein; generally safe, but may cause bloating in some people.","safe","Safe for dogs in small amounts and sometimes used in supplements.","safe","Safe for cats in small amounts.","EU food labels"
yeast_extract,"A concentrated ingredient made from yeast to boost flavor.","Used in soups, snacks, and savory foods.","Naturally rich in umami taste.","caution","Contains natural glutamates; generally safe but sometimes avoided by people sensitive to flavor enhancers.","safe","Safe for dogs in small amounts.","safe","Safe for cats in small amounts.","EU food labels"
coffee,"A drink made from roasted coffee beans.","Used in beverages and desserts.","One of the most consumed drinks worldwide.","caution","Contains caffeine, which can affect sleep, heart rate, and anxiety in high amounts.","limit","Toxic to dogs due to caffeine and can cause serious symptoms.","limit","Toxic to cats and should be avoided.","EU food labels"
coffee_extract,"A concentrated form of coffee flavor.","Used in desserts, drinks, and flavoring.","Adds strong coffee taste.","caution","Contains caffeine; effects similar to coffee but more concentrated.","limit","Toxic to dogs due to caffeine.","limit","Toxic to cats.","EU food labels"
